{
  "schema": "boe.mtt.augmented-heterotic-triangular-principal-symbol.v1",
  "claim_id": "CBF.T57",
  "date": "2026-09-01",
  "status": "EXACT_PROJECTOR_CORRECTED_TRIANGULAR_SYMBOL_AND_SAME_SOURCE_METRIC_NORMALIZATION_RECOVERY_CONDITIONAL_Q79_SOURCE_REDUCTION",
  "source_provenance": {
    "model_state_sha256": "f92c7c23388a1de1076e33b2f18ca97c689cc5c9c66340678238c86e8573e1a1",
    "handoff_id": "9ff36ef1-eb65-4825-ab64-682c94e25968",
    "source_checks": [
      {
        "id": "T56_THEOREM",
        "path": "DiracDolbeaultPrincipalSymbolAndSameSourceMetricBridgeTheorem_v1.md",
        "expected_sha256": "5e5703823ca4079716c93c4f80dfd7c44908caf9bd4a64b35c258c54d25889e6",
        "actual_sha256": "5e5703823ca4079716c93c4f80dfd7c44908caf9bd4a64b35c258c54d25889e6",
        "matches": true
      },
      {
        "id": "T56_PACKET",
        "path": "dirac_dolbeault_principal_symbol_bridge.packet.json",
        "expected_sha256": "d9d455a1a727879e4f8bdbf17d4a0e3435b1ac2c22379e376069693751ca4576",
        "actual_sha256": "d9d455a1a727879e4f8bdbf17d4a0e3435b1ac2c22379e376069693751ca4576",
        "matches": true
      },
      {
        "id": "T52_PACKET",
        "path": "q79_hermitian_metric_hodge_compiler.packet.json",
        "expected_sha256": "7b8683a56da2cb9773a933502790e06e91ca478624573240e2db0fefc87586c4",
        "actual_sha256": "7b8683a56da2cb9773a933502790e06e91ca478624573240e2db0fefc87586c4",
        "matches": true
      },
      {
        "id": "T55_PACKET",
        "path": "same_source_principal_symbol_metric_hodge_naturality.packet.json",
        "expected_sha256": "98795072d9d35c40120a86340050b2a5f7e865ec7b4c1a9e651c88cd924cce03",
        "actual_sha256": "98795072d9d35c40120a86340050b2a5f7e865ec7b4c1a9e651c88cd924cce03",
        "matches": true
      },
      {
        "id": "AUGMENTED_COMPILER_AUDIT",
        "path": "augmented_heterotic_triangular_external_source.audit.json",
        "expected_sha256": "209cc8ae24038fdab9f5ef28fac78d3b169ec5f6d771824f71ccec0758fc1b81",
        "actual_sha256": "209cc8ae24038fdab9f5ef28fac78d3b169ec5f6d771824f71ccec0758fc1b81",
        "matches": true
      }
    ],
    "all_sources_hash_locked": true,
    "external_audit": {
      "schema": "boe.mtt.external-source-audit.v1",
      "audit_id": "CBF.T57.AUDIT",
      "date": "2026-09-01",
      "role": "source_locked_design_input_not_a_selected_physical_endpoint",
      "source_repository": {
        "path": "C:/Users/nero_/Downloads/TEXPAPERS/20 Mathematical Language Discovery Program - Closure Dynamics",
        "git_head": "aafecf2201ab5573b63968175592062d91d10a0a",
        "read_only_during_CBF_T57": true
      },
      "sources": [
        {
          "id": "Q79_AUGMENTED_ENDPOINT_THEOREM",
          "path": "Q79_AUGMENTED_ENDPOINT_HILBERT_SPECTRAL_COMPILER_THEOREM_v1.md",
          "sha256": "77453971f76294863f6acda44d3051143376497375452322a114d3a83ab7ea24",
          "accepted_content": "The corrected upper complex is triangular: Y_n=Omega^(0,n)(Q_phys) direct-sum Omega^(0,n+1)(X), with diagonal Dolbeault lanes and alternating first-order partial lane.",
          "scope_boundary": "The theorem assumes a selected compact endpoint, pairing and Hilbert data; it does not emit the physical q79 source or calculate the complete cotangent Hodge principal symbol."
        },
        {
          "id": "Q79_AUGMENTED_ENDPOINT_PACKET",
          "path": "q79_augmented_endpoint_hilbert_spectral_compiler.packet.json",
          "sha256": "8024814dcbcfd3fc24231cb5ad1fbc77f9ffc16b42742bdcf338f689f9ff53f0",
          "accepted_content": "The finite weighted witness validates nilpotence, adjoints, Hodge positivity, compact-resolvent reduction and Galerkin convergence for supplied data.",
          "scope_boundary": "Its finite witness is not the physical rank-102 q79 endpoint and does not select its metric, connection, density or relative lane normalization."
        }
      ],
      "joint_conclusion": {
        "triangular_complex_formula_is_adopted": true,
        "first_order_partial_lane_must_be_included_in_principal_symbol": true,
        "selected_physical_q79_endpoint_is_present": false,
        "selected_physical_relative_lane_normalization_is_present": false,
        "selected_visible_hidden_HYM_connection_is_present": false
      }
    },
    "external_sources_are_audited_design_inputs_not_runtime_dependencies": true
  },
  "triangular_symbol_theorem": {
    "complex": "Y_n=Omega^(0,n)(Q) direct-sum Omega^(0,n+1)(X)",
    "differential": "L_n=[[dbar_Q,a(-1)^n partial],[0,dbar]]",
    "partial_coefficient_a": "1/2",
    "relative_lane_normalization_symbol": "rho=m_Q/m_shifted",
    "degree_one_formula": "sigma_2(Delta_Y,1)(xi)=q(xi)I+a^2 rho q(xi)P_xi",
    "projector_formula": "P_xi=(p_alpha tensor I_Lambda01) direct-sum I_Lambda02",
    "projector_rank": 6,
    "off_diagonal_second_order_terms_cancel": true,
    "full_augmented_symbol_is_scalar": false,
    "eigenvalues": [
      "q",
      "q(1+a^2 rho)"
    ],
    "relative_normalization_recovery": "rho=(lambda_high/lambda_low-1)/a^2",
    "general_degree_one_dimension": "3r+3",
    "general_multiplicities": {
      "baseline": "3r-3",
      "elevated": 6
    },
    "normalized_trace_factor": "1+2a^2 rho/(r+1)",
    "T56_scope_correction": "T56 applies to the diagonal Dirac/Dolbeault blocks; T57 is required for the full first-order triangular totalization."
  },
  "exact_six_dimensional_witness": {
    "real_dimension": 6,
    "complex_dimension": 3,
    "Q_rank": 4,
    "degree_one_dimension": 15,
    "partial_coefficient_a": "1/2",
    "relative_lane_normalization_fixture_rho": "1",
    "relative_lane_normalization_fixture_is_physical": false,
    "coframe": [
      [
        "1",
        "0",
        "1",
        "-1",
        "0",
        "0"
      ],
      [
        "0",
        "1",
        "1",
        "1",
        "0",
        "0"
      ],
      [
        "0",
        "0",
        "1",
        "0",
        "1",
        "1"
      ],
      [
        "0",
        "0",
        "0",
        "1",
        "-1",
        "1"
      ],
      [
        "0",
        "0",
        "0",
        "0",
        "1",
        "0"
      ],
      [
        "0",
        "0",
        "0",
        "0",
        "0",
        "1"
      ]
    ],
    "covariant_metric_G": [
      [
        "1",
        "0",
        "1",
        "-1",
        "0",
        "0"
      ],
      [
        "0",
        "1",
        "1",
        "1",
        "0",
        "0"
      ],
      [
        "1",
        "1",
        "3",
        "0",
        "1",
        "1"
      ],
      [
        "-1",
        "1",
        "0",
        "3",
        "-1",
        "1"
      ],
      [
        "0",
        "0",
        "1",
        "-1",
        "3",
        "0"
      ],
      [
        "0",
        "0",
        "1",
        "1",
        "0",
        "3"
      ]
    ],
    "contravariant_metric_H": [
      [
        "7",
        "0",
        "-3",
        "3",
        "2",
        "0"
      ],
      [
        "0",
        "7",
        "-3",
        "-3",
        "0",
        "2"
      ],
      [
        "-3",
        "-3",
        "3",
        "0",
        "-1",
        "-1"
      ],
      [
        "3",
        "-3",
        "0",
        "3",
        "1",
        "-1"
      ],
      [
        "2",
        "0",
        "-1",
        "1",
        "1",
        "0"
      ],
      [
        "0",
        "2",
        "-1",
        "-1",
        "0",
        "1"
      ]
    ],
    "sample_count": 21,
    "samples": [
      {
        "label": "e1",
        "row": 0,
        "column": null,
        "covector": [
          "1",
          "0",
          "0",
          "0",
          "0",
          "0"
        ],
        "metric_quadratic_q": "7",
        "complex_symbol_beta": [
          "1",
          "-1+i",
          "2"
        ],
        "nilpotence_exact": true,
        "nilpotence_sha256": "1cc62edde28b26b1766136be2ca9af784f2e0c2c071efa608377530cbaccbbe0",
        "Hodge_symbol_sha256": "a3d74f692c171f6e3b64bd3214785b041a274587d1f27be45b68bc1baec06b8a",
        "projector_sha256": "4a67fbfefe99c3ecec8365e3dd3e718495c1b7536f46d676c7df89215ba51f78",
        "projector_exact": true,
        "projector_rank": 6,
        "off_diagonal_second_order_cancellation": true,
        "baseline_eigenvalue": "7",
        "elevated_eigenvalue": "35/4",
        "baseline_multiplicity": 9,
        "elevated_multiplicity": 6,
        "two_level_identity_exact": true,
        "normalized_trace": "77/10",
        "normalized_trace_factor": "11/10",
        "scalar_ansatz_residual_rank": 6,
        "corrected_baseline_action_scalar": "49"
      },
      {
        "label": "e1+e2",
        "row": 0,
        "column": 1,
        "covector": [
          "1",
          "1",
          "0",
          "0",
          "0",
          "0"
        ],
        "metric_quadratic_q": "14",
        "complex_symbol_beta": [
          "1+i",
          "-2",
          "2+2i"
        ],
        "nilpotence_exact": true,
        "nilpotence_sha256": "1cc62edde28b26b1766136be2ca9af784f2e0c2c071efa608377530cbaccbbe0",
        "Hodge_symbol_sha256": "96243b94ce2be764013eedfaae7fe9bb518405112e27352ab01dceb7e720fb59",
        "projector_sha256": "4a67fbfefe99c3ecec8365e3dd3e718495c1b7536f46d676c7df89215ba51f78",
        "projector_exact": true,
        "projector_rank": 6,
        "off_diagonal_second_order_cancellation": true,
        "baseline_eigenvalue": "14",
        "elevated_eigenvalue": "35/2",
        "baseline_multiplicity": 9,
        "elevated_multiplicity": 6,
        "two_level_identity_exact": true,
        "normalized_trace": "77/5",
        "normalized_trace_factor": "11/10",
        "scalar_ansatz_residual_rank": 6,
        "corrected_baseline_action_scalar": "98"
      },
      {
        "label": "e1+e3",
        "row": 0,
        "column": 2,
        "covector": [
          "1",
          "0",
          "1",
          "0",
          "0",